{
  "agentId": "urn:missionweave:agent:developer-one",
  "sessionEpoch": 7,
  "status": "online",
  "capacity": {"maxSlots": 2, "activeSlots": 1, "availableSlots": 1, "queuedItems": 4},
  "capabilityAvailability": [
    {
      "capability": {"id": "acme.software.python-implementation", "version": "2.1.0"},
      "status": "available"
    }
  ],
  "estimatedResponseMs": 250,
  "lastHeartbeat": "2026-07-15T00:00:00Z",
  "expiresAt": "2026-07-15T00:00:30Z"
}
